{
  "$schema": "https://json-schema.org/draft/2020-12/schema",
  "$id": "https://raw.githubusercontent.com/shlomoa/openui-spec/main/spec/openui.schema.json",
  "title": "OpenUI Specification Document",
  "type": "object",
  "additionalProperties": false,
  "required": ["version", "id", "type"],
  "properties": {
    "version": { "$ref": "#/$defs/version" },
    "id": {
      "type": "string",
      "const": "root"
    },
    "type": { "$ref": "#/$defs/typeName" },
    "attrs": { "$ref": "#/$defs/attrs" },
    "children": { "$ref": "#/$defs/children" }
  },
  "$defs": {
    "version": {
      "type": "string",
      "pattern": "^[0-9]+\\.[0-9]+\\.[0-9]+$"
    },
    "typeName": {
      "type": "string",
      "pattern": "^(?:[a-z][a-z0-9]*(?:-[a-z0-9]+)*|[A-Z][A-Za-z0-9]*(?:-[a-z][a-z0-9]*)?)$"
    },
    "attrs": {
      "type": "object",
      "propertyNames": {
        "pattern": "^(?:(?:uses|produces|behaves)\\.)?[a-z][A-Za-z0-9]*$"
      },
      "additionalProperties": { "$ref": "#/$defs/attrValue" }
    },
    "attrValue": {
      "anyOf": [
        { "$ref": "#/$defs/scalarValue" },
        {
          "type": "array",
          "items": { "$ref": "#/$defs/scalarValue" }
        }
      ]
    },
    "scalarValue": {
      "type": ["string", "number", "boolean", "null"]
    },
    "children": {
      "type": "array",
      "items": {
        "$ref": "#/$defs/element"
      }
    },
    "element": {
      "type": "object",
      "additionalProperties": false,
      "required": ["id", "type"],
      "properties": {
        "id": {
          "type": "string",
          "pattern": "^[a-z][A-Za-z0-9]*$"
        },
        "type": { "$ref": "#/$defs/typeName" },
        "attrs": { "$ref": "#/$defs/attrs" },
        "children": { "$ref": "#/$defs/children" }
      }
    }
  }
}
