{
  "id": "root",
  "version": "0.14.0",
  "type": "ChoiceControls",
  "attrs": {
    "title": "\"Choice controls example\""
  },
  "children": [
    {
      "id": "shippingChoice",
      "type": "ChoiceControls",
      "attrs": {
        "uses.label": "\"Shipping speed\"",
        "uses.value": "shippingSpeed",
        "produces.selectionChange": "onShippingSpeedChange($event)",
        "uses.selection": "\"single\"",
        "uses.required": "true"
      },
      "children": [
        {
          "id": "standardOption",
          "type": "option",
          "attrs": {
            "uses.label": "\"Standard\"",
            "uses.value": "\"standard\""
          }
        },
        {
          "id": "expressOption",
          "type": "option",
          "attrs": {
            "uses.label": "\"Express\"",
            "uses.value": "\"express\""
          }
        }
      ]
    },
    {
      "id": "newsletterOptIn",
      "type": "ChoiceControls",
      "attrs": {
        "uses.label": "\"Send me the newsletter\"",
        "uses.checked": "optedIn",
        "uses.disabled": "isSaving",
        "produces.selectionChange": "onOptInChange($event)"
      }
    },
    {
      "id": "selectAllOptions",
      "type": "ChoiceControls",
      "attrs": {
        "uses.label": "\"Select all\"",
        "uses.indeterminate": "someSelected"
      }
    },
    {
      "id": "suggestionBackedComboBox",
      "type": "ChoiceControls"
    },
    {
      "id": "selectionMode",
      "type": "ChoiceControls"
    },
    {
      "id": "multiSelectComboBox",
      "type": "ChoiceControls"
    },
    {
      "id": "fontFamilySelector",
      "type": "ChoiceControls"
    },
    {
      "id": "exclusiveSelectionCoordination",
      "type": "ChoiceControls"
    }
  ]
}
