{
  "id": "root",
  "version": "0.11.0",
  "type": "FeedbackWidgets",
  "attrs": {
    "title": "\"Feedback widgets example\""
  },
  "children": [
    {
      "id": "saveFeedback",
      "type": "FeedbackWidgets",
      "attrs": {
        "uses.message": "\"Saved successfully.\"",
        "uses.severity": "\"success\""
      }
    },
    {
      "id": "contextualHelp",
      "type": "FeedbackWidgets"
    },
    {
      "id": "startupScreen",
      "type": "FeedbackWidgets"
    },
    {
      "id": "illustratedMessage",
      "type": "FeedbackWidgets"
    }
  ]
}
