{
  "id": "root",
  "version": "0.5.0",
  "type": "PickerControl",
  "attrs": {
    "title": "\"Picker control example\""
  },
  "children": [
    {
      "id": "accentPicker",
      "type": "PickerControl",
      "attrs": {
        "[label]": "\"Accent color\"",
        "[value]": "accentColor",
        "(valueChange)": "onAccentColorChange($event)"
      }
    },
    {
      "id": "fontPicker",
      "type": "PickerControl"
    },
    {
      "id": "folderPicker",
      "type": "PickerControl"
    }
  ]
}
