{
  "id": "root",
  "version": "0.12.0",
  "type": "LinkAndScrollControls",
  "attrs": {
    "title": "\"Link and scroll controls example\""
  },
  "children": [
    {
      "id": "skipToContent",
      "type": "LinkAndScrollControls",
      "attrs": {
        "uses.label": "\"Skip to content\"",
        "uses.href": "\"#main\"",
        "produces.activate": "scrollToMain()"
      }
    }
  ]
}
