{
  "id": "root",
  "version": "0.8.0",
  "type": "Collapsible",
  "attrs": {
    "title": "\"Collapsible example\""
  },
  "children": [
    {
      "id": "detailsSection",
      "type": "section",
      "attrs": {
        "text": "\"Collapsible content\""
      }
    },
    {
      "id": "detailsCollapsible",
      "type": "Collapsible",
      "attrs": {
        "uses.target": "\"detailsSection\""
      }
    }
  ]
}
