{
  "id": "root",
  "version": "0.6.0",
  "type": "DataGrid",
  "attrs": {
    "title": "\"Data grid example\""
  },
  "children": [
    {
      "id": "ordersGrid",
      "type": "DataGrid",
      "attrs": {
        "[data]": "orders",
        "[selection]": "\"multiple\"",
        "[sortable]": "true",
        "(selectionChange)": "onOrderSelection($event)"
      }
    }
  ]
}
