{
  "id": "root",
  "version": "0.12.0",
  "type": "ToolAction",
  "children": [
    {
      "id": "refreshAction",
      "type": "ToolAction",
      "attrs": {
        "uses.label": "\"Refresh\"",
        "uses.icon": "\"refresh\"",
        "uses.disabled": "false",
        "produces.activate": "refresh()"
      }
    }
  ]
}
