{
  "id": "root",
  "version": "0.14.0",
  "type": "Presentation",
  "attrs": {
    "title": "\"Presentation abstraction example\""
  },
  "children": [
    {
      "id": "visualTheme",
      "type": "Presentation",
      "attrs": {
        "uses.colorScheme": "\"light\"",
        "uses.density": "\"comfortable\"",
        "uses.typography": "\"system\""
      }
    }
  ]
}
