{
  "id": "root",
  "version": "0.14.0",
  "type": "Internationalization",
  "attrs": {
    "title": "\"Internationalization abstraction example\""
  },
  "children": [
    {
      "id": "localeRules",
      "type": "Internationalization",
      "attrs": {
        "uses.locale": "\"en-US\"",
        "uses.direction": "\"ltr\"",
        "uses.dateFormat": "\"mediumDate\""
      }
    }
  ]
}
